{
    "@context": "http://iiif.io/api/presentation/3/context.json",
    "id": "https://preview.iiif.io/cookbook/309-annotation-collections/recipe/0309-annotation-collection/anno_p1.json",
    "type": "AnnotationPage",
    "partOf": [{
        "id": "https://preview.iiif.io/cookbook/309-annotation-collections/recipe/0309-annotation-collection/anno_coll.json",
        "type": "AnnotationCollection"
    }],
    "next": {
        "id": "https://preview.iiif.io/cookbook/309-annotation-collections/recipe/0309-annotation-collection/anno_p2.json",
        "type": "AnnotationPage"
    },
    "items": [
        {
            "id": "https://preview.iiif.io/cookbook/309-annotation-collections/recipe/0309-annotation-collection/anno_p1.json-1",
            "type": "Annotation",
            "motivation": "tagging",
            "body": {
                "type": "TextualBody",
                "format": "text/plain",
                "value": "text-1-1"
            },
            "target": {
                "type": "SpecificResource",
                "source": {
                    "id": "https://preview.iiif.io/cookbook/309-annotation-collections/recipe/0309-annotation-collection/canvas/p1",
                    "type": "Canvas",
                    "partOf": [{
                        "id": "https://preview.iiif.io/cookbook/309-annotation-collections/recipe/0309-annotation-collection/manifest.json",
                        "type": "Manifest"
                    }]
                },
                "selector": {
                    "type": "FragmentSelector",
                    "conformsTo": "http://www.w3.org/TR/media-frags/",
                    "value": "xywh=88,957,2768,248"
                }
            }
        }
    ]
}