{
  "@context": "http://iiif.io/api/presentation/3/context.json",
  "id": "https://preview.iiif.io/cookbook/0306-linking-annotations-to-manifests/recipe/0306-linking-annotations-to-manifests/manifest.json",
  "type": "Manifest",
  "label": {
    "en": [
      "Picture of GÃ¶ttingen taken during the 2019 IIIF Conference"
    ]
  },
  "items": [
    {
      "id": "https://preview.iiif.io/cookbook/0306-linking-annotations-to-manifests/recipe/0306-linking-annotations-to-manifests/canvas-1",
      "type": "Canvas",
      "height": 3024,
      "width": 4032,
      "items": [
        {
          "id": "https://preview.iiif.io/cookbook/0306-linking-annotations-to-manifests/recipe/0306-linking-annotations-to-manifests/canvas-1/annopage-1",
          "type": "AnnotationPage",
          "items": [
            {
              "id": "https://preview.iiif.io/cookbook/0306-linking-annotations-to-manifests/recipe/0306-linking-annotations-to-manifests/canvas-1/annopage-1/anno-1",
              "type": "Annotation",
              "motivation": "painting",
              "body": {
                "id": "https://iiif.io/api/image/3.0/example/reference/918ecd18c2592080851777620de9bcb5-gottingen/full/max/0/default.jpg",
                "type": "Image",
                "format": "image/jpeg",
                "height": 3024,
                "width": 4032,
                "service": [
                  {
                    "id": "https://iiif.io/api/image/3.0/example/reference/918ecd18c2592080851777620de9bcb5-gottingen",
                    "profile": "level1",
                    "type": "ImageService3"
                  }
                ]
              },
              "target": "https://preview.iiif.io/cookbook/0306-linking-annotations-to-manifests/recipe/0306-linking-annotations-to-manifests/canvas-1"
            }
          ]
        }
      ],
      "annotations": [
        {
          "id": "https://preview.iiif.io/cookbook/0306-linking-annotations-to-manifests/recipe/0306-linking-annotations-to-manifests/annotationpage.json",
          "type": "AnnotationPage"
        }
      ]
    }
  ]
}