{
  "@context": "http://iiif.io/api/presentation/3/context.json",
  "id": "https://preview.iiif.io/cookbook/0103-poetry/recipe/0103-poetry-reading-annotations/annotations.json",
  "type": "AnnotationPage",
  "items": [
    {
      "id": "https://preview.iiif.io/cookbook/0103-poetry/recipe/0103-poetry-reading-annotations/canvas/annotation1",
      "type": "Annotation",
      "motivation": "commenting",
      "body": {
        "type": "TextualBody",
        "value": "breath",
        "format": "text/plain"
      },
      "target": {
        "type": "SpecificResource",
        "source": "https://preview.iiif.io/cookbook/0103-poetry/recipe/0103-poetry-reading-annotations/canvas/1",
        "selector": {
          "type": "PointSelector",
          "t": 27.660653
        }
      }
    }
  ]
}
