{
  "@context": "http://iiif.io/api/presentation/3/context.json",
  "id": "http://localhost:4000/recipe/0219-using-caption-file/manifest.json",
  "type": "Manifest",
  "label": {
    "en": [
      "Lunchroom Manners"
    ]
  },
  "items": [
    {
      "id": "http://localhost:4000/recipe/0219-using-caption-file/canvas",
      "type": "Canvas",
      "height": 360,
      "width": 480,
      "duration": 572.034,
      "items": [
        {
          "id": "http://localhost:4000/recipe/0219-using-caption-file/canvas/page",
          "type": "AnnotationPage",
          "items": [
            {
              "id": "http://localhost:4000/recipe/0219-using-caption-file/canvas/page/annotation",
              "type": "Annotation",
              "motivation": "painting",
              "body": [
                {
                  "id": "https://fixtures.iiif.io/video/indiana/lunchroom_manners/high/lunchroom_manners_1024kb.mp4",
                  "type": "Video",
                  "height": 360,
                  "width": 480,
                  "duration": 572.034,
                  "format": "video/mp4"
                },
                {
                  "id": "https://fixtures.iiif.io/video/indiana/lunchroom_manners/lunchroom_manners.vtt",
                  "type": "Text",
                  "format": "text/vtt",
                  "language": "en"
                }
              ],
              "target": "http://localhost:4000/recipe/0219-using-caption-file/canvas"
            }
          ]
        }
      ]
    }
  ]
}