{
  "@context": "http://iiif.io/api/presentation/3/context.json",
  "id": "https://iiif.io/api/cookbook/recipe/0013-placeholderCanvas/manifest.json",
  "type": "Manifest",
  "label": {
    "en": [
      "Video recording of Donizetti's _The Elixer of Love_"
    ]
  },
  "items": [
    {
      "id": "https://iiif.io/api/cookbook/recipe/0013-placeholderCanvas/canvas/donizetti",
      "type": "Canvas",
      "duration": 7278.466,
      "width": 640,
      "height": 360,
      "placeholderCanvas": {
        "id": "https://iiif.io/api/cookbook/recipe/0013-placeholderCanvas/canvas/donizetti/placeholder",
        "type": "Canvas",
        "width": 640,
        "height": 360,
        "items": [
          {
            "id": "https://iiif.io/api/cookbook/recipe/0013-placeholderCanvas/canvas/donizetti/placeholder/1",
            "type": "AnnotationPage",
            "items": [
              {
                "id": "https://iiif.io/api/cookbook/recipe/0013-placeholderCanvas/canvas/donizetti/placeholder/1-image",
                "type": "Annotation",
                "motivation": "painting",
                "body": {
                  "id": "https://fixtures.iiif.io/video/indiana/donizetti-elixir/act1-thumbnail.png",
                  "type": "Image",
                  "format": "image/png",
                  "width": 640,
                  "height": 360
                },
                "target": "https://iiif.io/api/cookbook/recipe/0013-placeholderCanvas/canvas/donizetti/placeholder"
              }
            ]
          }
        ]
      },
      "items": [
        {
          "id": "https://iiif.io/api/cookbook/recipe/0013-placeholderCanvas/donizetti/1",
          "type": "AnnotationPage",
          "items": [
            {
              "id": "https://iiif.io/api/cookbook/recipe/0013-placeholderCanvas/donizetti/1-video",
              "type": "Annotation",
              "motivation": "painting",
              "body": {
                "id": "https://fixtures.iiif.io/video/indiana/donizetti-elixir/vae0637_accessH264_low.mp4",
                "type": "Video",
                "duration": 7278.466,
                "width": 640,
                "height": 360,
                "format": "video/mp4"
              },
              "target": "https://iiif.io/api/cookbook/recipe/0013-placeholderCanvas/canvas/donizetti"
            }
          ]
        }
      ]
    }
  ]
}