{
  "@context": "http://iiif.io/api/presentation/3/context.json",
  "id": "https://example.org/iiif/book1/manifest",
  "type": "Manifest",
  "label": { "en": [ "Book 1" ] },
    "items": [
        {
          "id": "https://example.org/iiif/book1/canvas/p1",
          "type": "Canvas",
          "label": { "none": [ "p. 1" ] },
          "height": 1000,
          "width": 750,
          "items": [
            {
              "id": "https://example.org/iiif/book1/page/p1/1",
              "type": "AnnotationPage",
              "items": [
                {
                  "id": "https://example.org/iiif/book1/annotation/p0001-image",
                  "type": "Annotation",
                  "motivation": "painting",
                  "body": {
                    "id": "https://example.org/iiif/book1/page1/full/full/0/default.jpg",
                    "type": "Image",
                    "format": "image/jpeg",
                    "service": [
                      {
                          "@id": "https://example.org/iiif2/image1/identifier",
                          "@type": "ImageService2",
                          "profile": "http://iiif.io/api/image/2/level2.json"
                      }
                    ],
                    "height": 2000,
                    "width": 1500
                  },
                  "target": "https://example.org/iiif/book1/canvas/p1"
                }
              ]
            }
          ],
          "annotations": [
            {
              "id": "https://example.org/iiif/book1/comments/p1/1",
              "type": "AnnotationPage"
            }
          ]
        }
    ]
}
