{
  "@context": "http://iiif.io/api/presentation/3/context.json",
  "id": "https://preview.iiif.io/cookbook/0306-linking-annotations-to-manifests/recipe/0306-linking-annotations-to-manifests/annotationpage.json",
  "type": "AnnotationPage",
  "items": [
    {
      "id": "https://preview.iiif.io/cookbook/0306-linking-annotations-to-manifests/recipe/0306-linking-annotations-to-manifests/canvas-1/annopage-2/anno-1",
      "type": "Annotation",
      "motivation": "commenting",
      "body": {
        "type": "TextualBody",
        "language": "de",
        "format": "text/plain",
        "value": "Der GÃ¤nseliesel-Brunnen"
      },
      "target": {
        "type": "SpecificResource",
        "source": {
          "id": "https://preview.iiif.io/cookbook/0306-linking-annotations-to-manifests/recipe/0306-linking-annotations-to-manifests/canvas-1",
          "type": "Canvas",
          "partOf": [
            {
              "id": "https://preview.iiif.io/cookbook/0306-linking-annotations-to-manifests/recipe/0306-linking-annotations-to-manifests/annotationpage.json",
              "type": "Manifest"
            }
          ]
        },
        "selector": {
          "type": "FragmentSelector",
          "conformsTo": "http://www.w3.org/TR/media-frags/",
          "value": "xywh=300,800,1200,1200"
        }
      }
    }
  ]
}